{
  "schemaVersion": "1.0.0",
  "qaId": "77777777-7777-4777-8777-777777777777",
  "assetId": "88888888-8888-4888-8888-888888888888",
  "sourceSha256": "aaaaaaaaaaaaaaaaaaaaaaaaaaaaaaaaaaaaaaaaaaaaaaaaaaaaaaaaaaaaaaaa",
  "lockMode": "STRICT",
  "scores": {
    "design": 5,
    "typography": 5,
    "geometry": 5,
    "realism": 4,
    "style": 4
  },
  "weightingVariant": "default",
  "weightedScore": 95,
  "status": "PASS_CANDIDATE",
  "hardVetoFindings": [],
  "humanDecision": "PENDING",
  "reviewedAt": null,
  "reviewerNote": "Synthetic example only. Not a real product approval."
}
